{
 "id": "RIN-000010",
 "type": "unit-plan",
 "pilot": "U-1",
 "roleProfile": "RPF-000003",
 "situationTemplate": "STM-0043",
 "title": "Wrong or missing item in a delivery — Food Delivery Executive (A2)",
 "cefr": "A2",
 "variantOf": null,
 "functions": [
  "CFN-0037",
  "CFN-0007",
  "CFN-0024"
 ],
 "excludedFunctions": [],
 "stakeholders": [
  "Customer",
  "Restaurant staff",
  "Support team (platform)"
 ],
 "constraints": [
  "No traffic or driving advice; communication only"
 ],
 "layers": [
  {
   "layer": "L0",
   "key": "L0|CFN-0037|A2",
   "objectId": "FEX-000015",
   "status": "PRESENT",
   "request": null,
   "sharedWith": []
  },
  {
   "layer": "L0",
   "key": "L0|CFN-0007|A2",
   "objectId": "FEX-000012",
   "status": "PRESENT",
   "request": null,
   "sharedWith": [
    "RIN-000008"
   ]
  },
  {
   "layer": "L0",
   "key": "L0|CFN-0024|A2",
   "objectId": "FEX-000016",
   "status": "PRESENT",
   "request": null,
   "sharedWith": []
  },
  {
   "layer": "L1",
   "key": "L1|STM-0043",
   "objectId": "SCN-000009",
   "status": "PRESENT",
   "request": null,
   "sharedWith": []
  },
  {
   "layer": "L2",
   "key": "L2|CM-06",
   "objectId": "CMC-000003",
   "status": "PRESENT",
   "request": null,
   "sharedWith": [
    "RIN-000008",
    "RIN-000009"
   ]
  },
  {
   "layer": "L3",
   "key": "L3|ROL-0157",
   "objectId": "RCO-000005",
   "status": "PRESENT",
   "request": null,
   "sharedWith": [
    "RIN-000008",
    "RIN-000009"
   ]
  },
  {
   "layer": "L4",
   "key": "L4|RPF-000003",
   "objectId": null,
   "status": "MISSING",
   "request": "REQ-000005",
   "sharedWith": [
    "RIN-000008",
    "RIN-000009"
   ]
  },
  {
   "layer": "L5",
   "key": "L5|SEN-0003|-",
   "objectId": null,
   "status": "MISSING",
   "request": "REQ-000005",
   "sharedWith": [
    "RIN-000004",
    "RIN-000005",
    "RIN-000006",
    "RIN-000007",
    "RIN-000008",
    "RIN-000009"
   ]
  },
  {
   "layer": "L6",
   "key": "L6|RPF-000003|STM-0043|A2",
   "objectId": null,
   "status": "MISSING",
   "request": "REQ-000009",
   "sharedWith": []
  }
 ],
 "reviewPolicy": {
  "aiQa": "REQUIRED (AI/content pipeline)",
  "editorial": "AUTHOR (author performs Editorial Review personally, D-U13b)",
  "specialist": "NOT_REQUIRED",
  "native": "NOT_REQUIRED",
  "specialistReason": "U-1 roles are deliberately non-regulated general business roles; DRV-sensitive content excluded by constraint (author ruling 4 October 2026)",
  "nativeReason": "No Bengali/Hindi content in U-1 (D-U08 clarification)"
 },
 "maxStatus": "APPROVED",
 "prototype": true,
 "publishable": false,
 "searchTerms": [
  "Food Delivery Executive",
  "delivery partner",
  "delivery boy",
  "rider",
  "Wrong or missing item in a delivery",
  "Food delivery (platform)"
 ],
 "differFrom": null
}
