{
 "id": "RIN-000005",
 "type": "unit-plan",
 "pilot": "U-1",
 "roleProfile": "RPF-000002",
 "situationTemplate": "STM-0026",
 "title": "Arranging and conducting a test drive — Car Sales Executive (B1)",
 "cefr": "B1",
 "variantOf": null,
 "functions": [
  "CFN-0091",
  "CFN-0097"
 ],
 "excludedFunctions": [
  {
   "function": "CFN-0108",
   "reason": "Safety instruction/warning is a DRV trigger; U-1 must stay specialist-free (author ruling). The unit covers arranging the test drive (licence, timing, route agreed by the dealership, accompanying the customer) and contains no driving or traffic-safety instructions."
  }
 ],
 "stakeholders": [
  "Customer"
 ],
 "constraints": [
  "No driving, traffic-law or vehicle-safety instructions; refer to 'the dealership's test-drive policy' generically"
 ],
 "layers": [
  {
   "layer": "L0",
   "key": "L0|CFN-0091|B1",
   "objectId": "FEX-000007",
   "status": "PRESENT",
   "request": null,
   "sharedWith": []
  },
  {
   "layer": "L0",
   "key": "L0|CFN-0097|B1",
   "objectId": "FEX-000008",
   "status": "PRESENT",
   "request": null,
   "sharedWith": []
  },
  {
   "layer": "L1",
   "key": "L1|STM-0026",
   "objectId": "SCN-000005",
   "status": "PRESENT",
   "request": null,
   "sharedWith": []
  },
  {
   "layer": "L2",
   "key": "L2|CM-03",
   "objectId": "CMC-000001",
   "status": "PRESENT",
   "request": null,
   "sharedWith": [
    "RIN-000001",
    "RIN-000002",
    "RIN-000004",
    "RIN-000006",
    "RIN-000007"
   ]
  },
  {
   "layer": "L3",
   "key": "L3|ROL-0016",
   "objectId": "RCO-000003",
   "status": "PRESENT",
   "request": null,
   "sharedWith": [
    "RIN-000004",
    "RIN-000006",
    "RIN-000007"
   ]
  },
  {
   "layer": "L3",
   "key": "L3|ROL-0050",
   "objectId": "RCO-000004",
   "status": "PRESENT",
   "request": null,
   "sharedWith": [
    "RIN-000004",
    "RIN-000006",
    "RIN-000007"
   ]
  },
  {
   "layer": "L4",
   "key": "L4|RPF-000002",
   "objectId": null,
   "status": "MISSING",
   "request": "REQ-000005",
   "sharedWith": [
    "RIN-000004",
    "RIN-000006",
    "RIN-000007"
   ]
  },
  {
   "layer": "L5",
   "key": "L5|SEN-0003|-",
   "objectId": null,
   "status": "MISSING",
   "request": "REQ-000005",
   "sharedWith": [
    "RIN-000004",
    "RIN-000006",
    "RIN-000007",
    "RIN-000008",
    "RIN-000009",
    "RIN-000010"
   ]
  },
  {
   "layer": "L6",
   "key": "L6|RPF-000002|STM-0026|B1",
   "objectId": null,
   "status": "MISSING",
   "request": "REQ-000007",
   "sharedWith": []
  }
 ],
 "reviewPolicy": {
  "aiQa": "REQUIRED (AI/content pipeline)",
  "editorial": "AUTHOR (author performs Editorial Review personally, D-U13b)",
  "specialist": "NOT_REQUIRED",
  "native": "NOT_REQUIRED",
  "specialistReason": "U-1 roles are deliberately non-regulated general business roles; DRV-sensitive content excluded by constraint (author ruling 4 October 2026)",
  "nativeReason": "No Bengali/Hindi content in U-1 (D-U08 clarification)"
 },
 "maxStatus": "APPROVED",
 "prototype": true,
 "publishable": false,
 "searchTerms": [
  "Car Sales Executive",
  "car salesman",
  "showroom sales",
  "relationship executive (auto)",
  "Arranging and conducting a test drive",
  "Car dealerships & showrooms"
 ],
 "differFrom": null
}
