{
 "id": "RIN-000003",
 "type": "unit-plan",
 "pilot": "U-1",
 "roleProfile": "RPF-000001",
 "situationTemplate": "STM-0034",
 "title": "Taking payment (cash, UPI, card) — Vegetable Seller (A1)",
 "cefr": "A1",
 "variantOf": null,
 "functions": [
  "CFN-0089"
 ],
 "excludedFunctions": [],
 "stakeholders": [
  "Customer"
 ],
 "constraints": [],
 "layers": [
  {
   "layer": "L0",
   "key": "L0|CFN-0089|A1",
   "objectId": "FEX-000005",
   "status": "PRESENT",
   "request": null,
   "sharedWith": []
  },
  {
   "layer": "L1",
   "key": "L1|STM-0034",
   "objectId": "SCN-000003",
   "status": "PRESENT",
   "request": null,
   "sharedWith": []
  },
  {
   "layer": "L2",
   "key": "L2|CM-04",
   "objectId": "CMC-000002",
   "status": "PRESENT",
   "request": null,
   "sharedWith": []
  },
  {
   "layer": "L3",
   "key": "L3|ROL-0080",
   "objectId": "RCO-000001",
   "status": "PRESENT",
   "request": null,
   "sharedWith": [
    "RIN-000001",
    "RIN-000002"
   ]
  },
  {
   "layer": "L3",
   "key": "L3|ROL-0081",
   "objectId": "RCO-000002",
   "status": "PRESENT",
   "request": null,
   "sharedWith": [
    "RIN-000001",
    "RIN-000002"
   ]
  },
  {
   "layer": "L4",
   "key": "L4|RPF-000001",
   "objectId": "CTX-000001",
   "status": "PRESENT",
   "request": null,
   "sharedWith": [
    "RIN-000001",
    "RIN-000002"
   ]
  },
  {
   "layer": "L5",
   "key": "L5|SEN-0012|solo",
   "objectId": "SNO-000001",
   "status": "PRESENT",
   "request": null,
   "sharedWith": [
    "RIN-000001",
    "RIN-000002"
   ]
  },
  {
   "layer": "L6",
   "key": "L6|RPF-000001|STM-0034|A1",
   "objectId": "RIN-000003",
   "status": "PRESENT",
   "request": null,
   "sharedWith": []
  }
 ],
 "reviewPolicy": {
  "aiQa": "REQUIRED (AI/content pipeline)",
  "editorial": "AUTHOR (author performs Editorial Review personally, D-U13b)",
  "specialist": "NOT_REQUIRED",
  "native": "NOT_REQUIRED",
  "specialistReason": "U-1 roles are deliberately non-regulated general business roles; DRV-sensitive content excluded by constraint (author ruling 4 October 2026)",
  "nativeReason": "No Bengali/Hindi content in U-1 (D-U08 clarification)"
 },
 "maxStatus": "APPROVED",
 "prototype": true,
 "publishable": false,
 "searchTerms": [
  "Vegetable Seller",
  "sabzi wala",
  "vegetable vendor",
  "vegetable shop",
  "Taking payment (cash, UPI, card)",
  "Fresh produce markets (vegetables & fruit)"
 ],
 "differFrom": null
}
